{
  "$schema": "./manual.schema.json",
  "project": {
    "name": "AmonRaRedux",
    "version": "1.0.0-dev"
  },
  "manual": {
    "title": "Amon Ra Redux Developer Manual & Modernization Roadmap",
    "subtitle": "Comprehensive engineering specification for patching and modernizing Laura Bow II (SCI 1.1 Floppy)",
    "description": "Architecture, decompilation, script patching, narrative coherence, and puzzle fixes based on the SCI 1.1 floppy release.",
    "badges": [
      "SCI 1.1",
      "DOS Floppy v1.000 Base",
      "Definitive Edition Patch"
    ]
  },
  "theme": {
    "icon": "\u2625"
  },
  "sections": [
    {
      "id": "foundations-tooling",
      "title": "Foundations and Toolchain",
      "description": "Base game assets, Wine execution environment, SCI Companion decompilation, and DOSBox-X regression testing.",
      "entries": [
        {
          "id": "floppy-base-architecture",
          "title": "Floppy v1.000 Base Engine Architecture",
          "summary": "The DOS floppy v1.000 release serves as the foundational source of truth for all modernizations.",
          "tags": [
            "core",
            "engine",
            "assets"
          ],
          "what": "Establishes Laura Bow II (Floppy v1.000) as the immutable base game directory. Loose patch files in the directory override compressed archive resources at runtime without corrupting original assets.",
          "how": {
            "lead": "The SCI 1.1 interpreter loads resources using a two-tier lookup mechanism:",
            "points": [
              "The interpreter searches the current directory for loose resource files matching the naming scheme <resourceNumber>.<resourceExt> (e.g., 0.SCR, 13.MSG).",
              "If no loose override exists, the interpreter queries RESOURCE.MAP for the offset and reads from RESOURCE.000.",
              "Original uncompressed brushstroke background pictures and EGA/VGA palettes are preserved directly from the floppy media."
            ]
          },
          "why": "The floppy release contains superior uncompressed brushstroke textures on backgrounds (such as the newsroom desk) and cleaner timing logic compared to the CD release. Building modular loose patches guarantees that original assets remain untouched and patches can be cleanly uninstalled or distributed.",
          "evidence": [
            {
              "label": "Game Version File",
              "target": "LB2/VERSION"
            },
            {
              "label": "Resource Configuration",
              "target": "LB2/RESOURCE.CFG"
            },
            {
              "label": "Resource Map",
              "target": "LB2/RESOURCE.MAP"
            }
          ],
          "related": [
            "sci-patch-mechanism",
            "sci-companion-wine-workflow",
            "p1-06-art-deco-preservation"
          ]
        },
        {
          "id": "sci-companion-wine-workflow",
          "title": "SCI Companion Execution Under Wine",
          "summary": "Win32 SCI Companion runs under Wine to decompile, edit, and recompile SCI 1.1 scripts and message resources.",
          "tags": [
            "tooling",
            "wine",
            "decompiler"
          ],
          "what": "Enables decompilation of compiled bytecodes (.SCR/.HEP) into human-readable SCI Studio / Sierra syntax (.sc), visual editing of message tables (.MSG), room priority boundaries (.PIC), and views (.V56) within Linux.",
          "how": {
            "lead": "The developer launches SCI Companion via Wine using the pre-compiled binary:",
            "points": [
              "Execution command: wine /home/gordonk/PycharmProjects/SCICompanion/Release/SCICompanion.exe LB2/RESOURCE.MAP.",
              "The 221-script compiler-facing baseline is reconstructed with Sluicebox annotations; globals, objects, procedures, control flow, and comments are readable while stable numeric selector IDs avoid contextual-alias collisions.",
              "The developer selector vocabulary uses sel_N names except for SCI metadata IDs 4098, 4100, 4102, and 4103; tools/normalize_selector_vocab.py rebuilds it deterministically.",
              "Recompiled scripts emit paired .SCR (code chunk) and .HEP (heap object definitions) back into the game directory for immediate execution."
            ]
          },
          "why": "Sluicebox provides high-level control-flow and symbol recovery, while SCI Companion remains the authoritative compiler. Stable numeric selectors preserve runtime IDs that a single global vocabulary cannot express with Sluicebox's contextual aliases.",
          "evidence": [
            {
              "label": "SCI Companion Binary",
              "target": "/home/gordonk/PycharmProjects/SCICompanion/Release/SCICompanion.exe"
            },
            {
              "label": "Decompiler Configuration",
              "target": "SCICompanion/Files/Decompiler/Decompiler.ini"
            }
          ],
          "related": [
            "floppy-base-architecture",
            "sci-patch-mechanism",
            "dosbox-x-testing-harness"
          ]
        },
        {
          "id": "sci-patch-mechanism",
          "title": "Modular SCI 1.1 Loose Patching Model",
          "summary": "Non-destructive drop-in patch architecture replacing only affected scripts and message lumps.",
          "tags": [
            "architecture",
            "build",
            "distribution"
          ],
          "what": "Compiles modified scripts and message lumps into individual standalone files in the LB2/ folder rather than repacking RESOURCE.000, enabling rapid iteration and isolated bug verification.",
          "how": [
            "Each bug fix targets specific script IDs (e.g., 0.SCR for global kernel logic, 13.SCR for interrogations, 440.SCR for Armor Room).",
            "The compiler emits <id>.SCR, <id>.HEP, and <id>.MSG.",
            "The original SCI interpreter under DOSBox-X loads loose files automatically in priority over RESOURCE.000 contents."
          ],
          "why": "Repacking RESOURCE.000 on every iteration risks whole-archive corruption, invalidates offset tables, and complicates git diff tracking. Loose patch distribution is the standard, verified Sierra patch methodology.",
          "evidence": [
            {
              "label": "Root Loose Scripts",
              "target": "LB2/0.SCR"
            },
            {
              "label": "Message Loose Resource",
              "target": "LB2/0.MSG"
            }
          ],
          "related": [
            "floppy-base-architecture",
            "dosbox-x-testing-harness"
          ]
        },
        {
          "id": "dosbox-x-testing-harness",
          "title": "DOSBox-X Original-Interpreter Regression Testing",
          "summary": "Regression testing through Sierra's original DOS SCI interpreter under DOSBox-X.",
          "tags": [
            "testing",
            "automation",
            "debugger"
          ],
          "what": "Executes LB2's SCIDHUV interpreter inside DOSBox-X so loose patches are tested in the original game runtime rather than an interpreter reimplementation.",
          "how": [
            "Launch command: ./tools/run_dosbox.sh.",
            "The checked-in DOSBox-X configuration mounts LB2 as drive C and launches scidhuv with the project's loose patches active.",
            "Script regression tests use deterministic in-game saves immediately before key branches; a dummy SDL driver provides a non-interactive startup smoke."
          ],
          "why": "The original SCI interpreter is the authoritative runtime for patch compatibility. DOSBox-X preserves that execution environment while remaining scriptable enough for startup smoke checks and repeatable manual save-state tests.",
          "evidence": [
            {
              "label": "DOSBox-X Launch Script",
              "target": "tools/run_dosbox.sh"
            }
          ],
          "related": [
            "sci-companion-wine-workflow",
            "sci-patch-mechanism"
          ]
        }
      ]
    },
    {
      "id": "phase-1-stability-ui",
      "title": "Phase 1: Critical Stability and UI/UX Overhaul",
      "description": "Phase 1 focuses on core user experience improvements: streamlining the cumbersome interrogation interface, restoring unrestricted save/load functionality, expanding minuscule hotspots, fixing the Act 2 About memory bug, and eliminating visual glitches.",
      "entries": [
        {
          "id": "p1-01-ui-interrogation",
          "title": "P1-01: User Interface (UI) Efficiency & Interrogation Streamlining",
          "summary": "Reduces interrogation from five clicks down to a context-sensitive double-click or fast-inquiry mode.",
          "tags": [
            "ui",
            "interrogation",
            "p1"
          ],
          "what": "Streamlines NPC questioning so players no longer need to execute five sequential clicks per inquiry. Clicking an NPC with the notebook directly activates their questioning topic list, and double-clicking re-asks the most recent or primary topic.",
          "how": {
            "lead": "Refactors event handling across Script 0 (IconBar/Game) and Script 13 (Notebook/Interrogation UI):",
            "points": [
              "In the NPC doVerb handler for verb vAsk (Ask), intercept the target actor instance.",
              "If double-click or modifier is detected, repeat last query immediately without opening modal UI.",
              "When opening the notebook, automatically select the target NPC in the character selector tab instead of forcing manual category and person re-selection.",
              "Retain active scroll position and focus on confirm button for keyboard/enter affirmation."
            ]
          },